,index,Premise 2,Conclusion,Premise 2_f1
608,1230,"Amber is an ancient, fossilized resin that sometimes contains the preserved bodies of small creatures, such as insects.","An ancient, fossilized resin that sometimes contains the preserved bodies of small creatures, such as insects, is admired for its beautiful appearance and is also used in jewelry.",1.0000001192092896
609,1232,Monitoring your health helps you to lessen the rate of sudden deaths.,phone and desktop apps help you to  lessen the rate of sudden deaths.,0.9292177557945251
610,1233,ongoing lack of sleep can lead to insomnia.,ongoing lack of sleep can lead to divorce.,0.9456514716148376
611,1234,The potential effects of soil contamination on human health can include cancer,The potential effects of soil contamination on human health can lead to death,0.9926816821098328
612,1235,A successful business plan is often associated with better performance,A successful business plan is often associated with bigger gains,0.9106215238571168
613,1237,Inflammation of sweating channels develops infection.,Hidradenitis Suppurativa develops infection.,0.8967990279197693
614,1240,Eating fast foods contain high levels of salt.,Eating fast foods could have an immediate impact on the proper functioning of a person's blood vessels.,0.9424397945404052
615,1243,Global food shortage can result in global food shortage.,changing ocean current can result in global food shortage.,0.899109423160553
616,1244,A hormone called gastrin increases stomach acid.,A hormone called gastrin causes stomach and duodenal ulcers. ,0.965094804763794
617,1248,Fatty fish benefit  hair density,"Fatty fish like salmon, herring and mackerel benefit  hair density",0.8664976954460144
618,1249,Trans fat increase your risk for heart disease ,Most fast food increase your risk for heart disease ,0.9559062719345092
619,1250,Spartacus destroyed the gladiators.,Spartacus changed the Romans perception of slaves.,0.9191730618476868
620,1251,Hosting sporting events can encourage tourism.,Hosting sporting events can boost local economy.,0.9448710083961488
621,1253,school is a place that children can interact with others.,school is a place that children can become more socialize.,0.9469504952430724
622,1254,"With the extra affordability that comes with food purchases today, it is easier to create a well-balanced diet for the average family","With the extra affordability that comes with food purchases today, it is easier to create a well-balanced diet for the average family",0.9098548889160156
623,1256,Honey contains high levels of triglycerides.,Honey can decerease your risk of heart disease.,0.9487867951393129
624,1258,water catchment areas reduce viability of cities,Urban sprawl diminishes viability of cities,0.910007119178772
625,1260,Wind decay increases the flow rate of water.,Wind decay means seagrasses tend to accumulate sediments.,0.894668698310852
626,1262,Dancing is a sport.,Dancing equals sport.,0.9318799376487732
627,1264,Vitamin D is the main source of vitamin D.,People who live in northern climate are less likely to benefit from the main source of vitamin D.,0.9457175135612488
628,1271,Training the cacao tree farmers is so difficult.,Providing safety training for all of the cacao tree farmers is so difficult.,0.9164952039718628
629,1272,Scientists tweak the neurons to send a signal in response to the light.,Scientists tweak the neurons to prompt the cells to send a signal in response to the light.,0.9463738799095154
630,1277,Less accidents can lead to a higher higher safety degreefor people in their city., fewer vehicles in the town can lead to a higher higher safety degreefor people in their city.,0.9371445178985596
631,1279,Inflammation can cause progressive tissue destruction.,Probiotics are effective against progressive tissue destruction.,0.9608659744262696
632,1280,Stressing out can lead to a quick temper,Psychological arousements can lead to a quick temper,0.940104603767395
633,1282,principles such as postponement and just-in-time within the value chain have brought about an excessive willingness to pay,principles such as postponement and just-in-time within the value chain have brought about an excessive willingness to pay for quick delivery of key components or items of high value-to-weight ratio,0.9295839667320251
634,1283,destruction of the insulating ability of fur-bearing mammals often are caused by floods.,"destruction of the insulating ability of fur-bearing mammals often are happened by accidents involving tankers, barges, pipelines, refineries, drilling rigs, and storage facilities.",0.9169143438339232
635,1284,Probiotics help you lose weight.,Probiotics can help weight loss.,0.9337237477302552
636,1288,Low self-esteem is a common cause of depression. ,Psychologists usually regard self-esteem as a  characteristic that influences our behaviour across many situations. ,0.8915495276451111
637,1290,Vancouver streets are slippery for driving now.,Vancouver streets are dangerous for driving now.,0.9251849055290222
638,1291,Things from previous guests may remain in the room because of cleaners,Things from previous guests may remain in the room because of cleaners,0.9488281607627868
639,1295,It's better to Qatar's entrepreneurs to seek global customers,Its better to Qatar's entrepreneurs to seek global customers,0.8663052916526794
640,1298,journalists are expected to be politically neutral,journalists are expected to be politically neutral,0.9062894582748412
641,1300,tributaries in the downstream direction from the main river impoundment have different levels of water,tributaries in the downstream direction from the main river impoundment contribute to the establishment of better conditions for some kinds of fish,0.9302760362625122
642,1301,many household products contain toxic chemicals,many household products give off poisonous gas,0.9900115728378296
643,1302,The benefits of globalization include higher wages,The benefits of globalization can increase inequality,0.9259209036827089
644,1303,A healthy lifestyle contributes to a healthy lifestyle,Drinking water contributes to a healthy lifestyle,0.9404506087303162
645,1304,Sunlight helps shift workers to have quality sleep,Wearing sunglasses during the morning commute home help shift workers to have quality sleep,0.9188843369483948
646,1305,"Logistics refers to storage, transport, transshipment, warehousing, and packaging","Logistics refers to storage, transport, transshipment, warehousing, material-handling, and packaging",0.8834080696105957
647,1307,reading books enhance pepole's speaking and writing fluency.,reading books help non-native speakers to enhance pepole's speaking and writing fluency.,0.90857595205307
648,1308,People living in hot and humid weather are more likely to get dehydrated.,People living in hot and humid weather are more likely to get dehydrated.,0.8782972693443298
649,1310,The liver is a great source ofanganese.,tea will help the body activate some of the enzymes in the body.,0.8825312852859497
650,1312,The discovery of America resulted in the discovery of the Americas.,Columbus sailings resulted in the discovery of America.,0.9280757904052734
651,1313,The cherry flower is a plant in early springs.,The cherry flower in early springs.,0.906116783618927
652,1316,Food addiction can adversely affect growth in children ,Prolonged media use can adversely affect growth in children ,0.9541555643081664
653,1318,Using technology in education creates new ideas. ,Using technology in education  promotes positive behavior. ,0.9564933776855468
654,1319,The Mayo Clinic says monosodium glutamate is suspected of causing migraines.,"The Mayo Clinic says Parmesan cheese, Cheddar cheese and Soy sauce are suspected of causing migraines.",0.9586793184280396
655,1320,Wave-cut notches happen due to the extra stress on cliff material,Wave-cut notches happen due to the extra stress on cliff material and a greater probability of the falling the slope material,0.9338409304618835
656,1321,Sugar is a food additive that provides a sweet taste like that of sugar while containing significantly less food energy than sugar-based sweeteners.,"Pre-workout supplements frequently contain a food additive that provides a sweet taste like that of sugar while containing significantly less food energy than sugar-based sweeteners, making it a zero-calorie or low-calorie sweetener or sugar alcohols.",0.9577856063842772
657,1322,"REM sleep undergo a number of physiological changes including increased brain activity, heart rate, and breathing rate.","Nearly all dreams occur during undergoing a number of physiological changes including increased brain activity, heart rate, and breathing rate.",0.9555569291114808
658,1323,Mira A” is a star at end of  its life,“Mira A” is a star at end of  its life,0.8765100836753845
659,1324,Bengal tiger is a great source of smell.,Bengal tiger has a keen sense of smell.,0.8796360492706299
660,1335,Peaceful living can contribute to creating a peaceful environment,Apartment complexes can contribute to creating a peaceful environment,0.9366434812545776
661,1337,the exam time pressure on students can lead to anxiety,the exam time pressure on students can lead to extra stress,0.9347177743911744
662,1338,The discovery of the sea route opened the way for the Portuguese to establish a long-lasting colonial empire in Asia.,Vasco da Gama opened the way for the Portuguese to establish a long-lasting colonial empire in Asia.,0.9868189692497252
663,1339,parrots are able to distinguish themselves from other animals.,parrots are able to distinguish themselves from other animals.,0.9087679386138916
664,1340,publications can put taxpayers under pressure,hosting a major sporting event like the Olympics can put taxpayers under pressure,0.9158858060836792
665,1342,"Water polarity gives water unique properties, such as a relatively high boiling point and high specific heat.","Special molecular structure gives water unique properties, such as a relatively high boiling point and high specific heat.",0.9860551357269288
666,1344,"a concordant coastline is a coastline with rocks of varying resistance, so the coastline has steeps","a concordant coastline is a coastline with rocks of varying resistance, so the coastline forms distinctive landforms, such as coves",0.9312559962272644
667,1345,People are aware of the efforts you've made when working in a team,People are aware of the efforts you've made when working in a team,0.9273783564567566
668,1347,Conscientious people love to check thing off a list.,Conscientious people love to check thing off a list.,0.8956542015075684
669,1348,Buying computers puts households who can't afford buying computers under enormous pressure,Some schools put households who can't afford buying computers under enormous pressure,0.9533430933952332
670,1349,"Lifting weights, or doing sit-ups and push-ups activities increase muscle mass.","Lifting weights, or doing sit-ups and push-ups activities help build and strengthen muscle groups in the body.",0.9484280943870544
671,1351,Some targeted policies can be helpful in covering the cost of preofessional services,Some targeted policies can be helpful in covering the cost of preofessional services of exporting,0.8968509435653687
672,1353,finning is an action in which fishers cut off the shark’s fin while the animal is still alive and throw the animal back into the water.,"Today, an action in which fishers cut off the shark’s fin while the shark is still alive and throw the animal back into the water. The shark is unable to swim or eat. In hours or days, it bleeds to death on the bottom of the ocean which is a big bussines, has increased.",0.9516107439994812
673,1354,"In manufacturing societies, women are the main labour force.",Child labour forms an intrinsic part of a society in In manufacturing societies.,0.8997726440429688
674,1355,People who are conscientious focus by understanding where your focus needs to be.,People who are conscientious focus by understanding where your focus needs to be.,0.9476622939109802
675,1356,Digital transformation can make it easier to access new technologies.,Digital transformation can increase the success of your business.,0.9259065985679626
676,1358,people who hire freelancers can respond quickly to their needs,startups that hire freelancers can respond quickly to their needs,0.8982176184654236
677,1359,I have a 5-hours trip ahead of me!,I have a 5-hours trip ahead of me!,0.9306373596191406
678,1361,The best to look for puffin is In the early morning or in the evening just before sunset.,The best to look for puffin is In the early morning or in the evening just before sunset.,0.9042909145355223
679,1362,Amano made a reliable source for proper design and implementation of aquarium.,Amano made a reliable source for proper design and implementation of aquarium.,0.948387861251831
680,1364,Inflammation can infect everything from our skin to our lungs,Our pillows can infect everything from our skin to our lungs,0.9575275778770448
681,1368,Antioxidants may have longer lasting effects,many of the antioxidants in pineapple may have longer lasting effects,0.9397346377372742
682,1370,Drought results in rising water levels.,Drought force villagers to migrate to big cities.,0.8728270530700684
683,1371,"Lauric acid gives coconut oil a long, straight structure, which is more easily absorbed deep into the hair shaft.","Coconut oil is predominantly made up of a kind of acid which gives coconut oil a long, straight structure, which is more easily absorbed deep into the hair shaft.",0.95428204536438
684,1372,Destroying the US embassy intensified tensions between Iran and the United States.,Iranian students intensified tensions between Iran and the United States.,0.9662340879440308
685,1373,it is easier for retail businesses to access foreign exchange,it is easier for retail businesses to save money for investment activities because of direct trade with suppliers,0.9003315567970276
686,1375,Sun exposure can lead to sunburn,Wilma had been at the beach,0.91128271818161
687,1376,People tend to be more productive with less stress,People tend to be more productive with enhanced natural light during the day,0.9468976259231568
688,1380,Plankton form oil after million years.,Plankton form oil after million years.,0.9056676030158995
689,1382,Some people can use Vitamin supplements.,Some people can use Vitamin supplements.,0.9155725836753844
690,1383,A good financial planning can help to reduce the cost of living,A good financial planning can particularly prove beneficial when a breadwinner becomes unable to work,0.9562348127365112
691,1384,Until the Industrial Revolution production and consumption gravitated as close to each other as feasible,Until the Industrial Revolution production and consumption gravitated as close to each other as feasible,0.92847341299057
692,1386,Urbanization leads to urbanization,Urbanization is linked to the destabilization of the society,0.9287465214729308
693,1387,Iron can be eaten instead of red meat.,Hamburger can be eaten instead of red meat.,0.9344340562820436
694,1388,Paul Pogba’s running ability has been hindered.,Paul Pogba’s running ability has been hindered.,0.8999091982841492
695,1391,Muslims have a generally positive view of the larger society., relative newcomers have a generally positive view of the larger society.,0.988361656665802
696,1393,"When bronchial tubes relax, energy levels increase.","When breathing becomes more comfortable, energy levels increase.",0.9722002744674684
697,1394,The Catagen period usually lasts two or three weeks.,The Catagen period usually lasts two or three weeks.,0.8835633993148804
698,1395,"In an absolute monarchy, the monarch rules as an autocrat, with the authority to regulate the government","In an absolute monarchy, the monarch rules as an autocrat, with the right to rule by decree, promulgate laws, and impose punishments",0.9692816138267516
699,1397,Internet malfunction cost online retailers a significant amount of income.,Internet malfunction cost online retailers a significant amount of income.,0.8776108622550964
700,1400,"When people have more time to do what they want, productivity, freedom and so on.","I try not to watch TV during days, then I have more time to do what they want, productivity, freedom and so on.",0.954396426677704
701,1401,Customers bring about a tailored experience for everyone,In-house solutions bring about a tailored experience for everyone,0.9385095834732056
702,1402,Low crime rates may materialise as high crime rates,Experiences of inferiority may materialise as high crime rates ,0.9107550978660583
703,1404,Osteoporosis may also occur due to cancer.,"Osteoporosis may also occur due to a number of diseases like deposition of the Immunoglobulin A, antibodies in the glomerulus.",0.9639753699302672
704,1405,The Romans targeted Greek empire as their religion and philosophy idol.,Ancient Romans targeted Greek empire as their religion and philosophy idol.,0.8968971967697144
705,1407,Top-tier employees would rather work in franchises,Top-tier employees would rather work in franchises,0.8984151482582092
706,1411,Having an online bank account allows you to access your bank account instantly,Having an online bank account is necessary to making a profitable investment,0.9099605679512024
707,1414,Tourism plays a significant role in economical development of every country.,Tourism industry plays a significant role in economical development of every country.,0.959244668483734
708,1415,the risk of experiencing depression is high in old people,the risk of experiencing depression is high in old people,0.8749186992645264
709,1416,Agricultural water usage can also give rise to land degradation,"Agricultural water usage can also give rise to the destruction of natural wetlands, the spread of water-borne diseases, and land degradation through salinization and waterlogging",0.9698174595832824
710,1419,A toxic chemical on the spot in my front yard,Someone spilled a toxic chemical on the spot in my front yard,0.91379714012146
711,1420,Pets are not usually welcomed on planes and trains,Pets are not usually welcomed on planes and trains,0.8834642767906189
712,1422,"Becomeing a better communicator and listener, requires learning American sign language.","Becomeing a better communicator and listener, increases your marketability.",0.9539099335670472
713,1424,Tar and Lut are the earliest version of the modern day guitar invented by Iranians.,The earliest version of the modern day guitar invented by Iranians.,0.934268355369568
714,1429,"Without the protection of the trees, the land is subject to floods.","Without the protection of the trees, the land is subject to erosion during the next years.",0.965842306613922
715,1430,Vitamin D can prevent bone deformitiesn and bone pains.,liver can prevent bone deformitiesn and bone pains.,0.9431803226470948
716,1431,Experiencing racism event can lead to aggressive behavior.,Experiencing racism event can lead to toxic levels of stress.,0.9276524782180786
717,1432,applying onion juice to the scalp might be essential to maintaining voluminous hair.,applying onion juice to the scalp might be essential to beauty and being handsome.,0.9564943313598632
718,1436,Mold has darker color and supplies a small amount of vitamins and minerals.,Brown sugar has darker color and supplies a small amount of vitamins and minerals.,0.9340558648109436
719,1438,Selenium is a powerful antioxidant that helps defend the body from oxidative stress.,"Selenium is a powerful antioxidant that helps defend the body from chronic diseases, such as heart disease and cancer.",0.90913063287735
720,1439,relaxing can bring about peace of mind,Living in an apartment can bring about peace of mind,0.9294146299362184
721,1442,we are responsible for the death of many sea creatures,we are responsible for the death of many sea creatures,0.9419447183609008
722,1445,Social media is a unique platform for sharing ideas,Social media is a unique platform for problem-solving,0.9877471327781676
723,1446,Growing food crops can free up the land for farming food crops.,Duckweed can free up the land for farming food crops.,0.9520993232727052
724,1447,allows for high utilization and less impact regarding new infrastructure,"Using models of transport forecasting,allows for high utilization and less impact regarding new infrastructure",0.9406111240386964
725,1448,The secret to execute top organizational goals is to hire highly skilled people,The secret to execute top organizational goals is to hire qualified people,0.9281260371208192
726,1450,Jobless people have few employment options.,Not having many employment options results in highest rate of start-ups.,0.9383593201637268
727,1452,ElNin?o makes the waters of the central and eastern Pacific warmer than normal.,A regulary occurring climate pattern makes the waters of the central and eastern Pacific warmer than normal.,1.000000238418579
728,1453,Carbon dioxide in the bloodstream looks better,stopping smoking can contribute to skin looks better,0.8897544145584106
729,1454,Customers value their time and respond well to companies with better customer service,Customers value their time and respond well to companies with better customer service,0.959788143634796
730,1456,one big reason consumers still visit physical stores is that they are less likely to feel uncomfortable,one big reason consumers still visit physical stores is that they are less likely to experience tension while shopping,0.934216856956482
731,1457,Stressing out can contribute to numbness.,long-term high blood sugar levels can contribute to numbness.,0.9222955107688904
732,1458,Edward Bloom fell in love with the girl he just met.,Edward Bloom fell in love with the girl he just met.,0.8792662024497986
733,1459,People who have a good relatinship with classmates in adolesents can control their behavior.,active family environment can control having a good relatinship with classmates in adolesents. ,0.8905020356178284
734,1461,Young people can change traditional value systems of a host community. ,Tourism can change traditional value systems of a host community. ,0.9090904593467712
735,1462,Feeding wild birds have some negative impact on birds.,"Feeding wild birds have some negative impact on birds like when people cause them to stray from their natural habits and ignore their instincts, and instead rely on the easy answers we’ve provided.",0.9543975591659546
736,1463,Superman has super combat skills.,Hawkeye has super combat skills.,0.9229952692985536
737,1469,you work better and more efficiently when you're not stressed,you work better and more efficiently when you're in a comfortable work space,0.9685468077659608
738,1471,Eating disorders are becoming more prevalent in non-Western countries.,Eating disorders are becoming more prevalent in non-Western countries.,0.9483233094215392
739,1473,increased land use allowed surplus crops,"by change in agriculture, Metal plows allowed surplus crops",0.8785767555236816
740,1475,Glass may look solid but it is a liquid as well.,Glass may look solid but it is a liquid as well.,0.8909599781036377
741,1476,There is a higher risk of bone loss associated with aging.,"There is a higher risk of skeletal damage at the wrist, spine, hip, knee, foot, and ankle associated with aging.",0.9478265643119812
742,1477,The invention of smartphones played a main role in the dawn of smartphones.,Improvement of computer science played a main role in the dawn of smartphones.,0.9701781868934632
743,1479,The elimination of Escobar resulted in the rise of street crime.,The elimination of Escobar dropped the crime rate by 70% percent in Columbia.,0.9120588302612304
744,1480,Technological advancement provides innovative and modern approach to forthcoming issues.,Azari Jahromi provides innovative and modern approach to forthcoming issues.,0.9092515707015992
745,1482,Facebook is a dangerous corporation,facebook is a dangerous corporation,0.8789034485816956
746,1483,Waterfalls can occur where a stream or river flows into a glacier,Waterfalls can occur where a stream or river flows into a glacier,0.9091366529464722
747,1484,Umbrella Corps. The Umbrella Corps destroyed the Raccoon City Zoo.,Umbrella Corps. Infected millions of habitats in Raccoon City.,0.9023122191429138
748,1485,"you're less likely to go bankrupt,when you have enough money","you're less likely to go bankrupt ,when you start working on a franchise",0.9112082719802856
749,1487,People who later received an autism diagnosis were less likely to start looking very quickly at the object of interest until both are engaging,"What the researchers found was that, on average, babies who later received an autism diagnosis were less likely to start looking very quickly at the object of interest until both are engaging",0.8979026079177856
750,1488,Barber is a member of the United States Army,Bill is a barber,0.8559849858283997
751,1490,Efforts by the Republic of Congo to protect the environment save animals of extinction.,Efforts by the Republic of Congo save animals of extinction.,0.9391117095947266
752,1494,Tourism can be very dangerous in places where resources are already scarce,Tourism can be very dangerous in places where resources are already scarce,0.9106503129005432
753,1495,The United States urged people to protest on the streets.,France’s government urged people to protest on the streets.,0.913723886013031
754,1498,Fantasy attracts the interest of younger audience.,Child-oriented advertisements attracts the interest of younger audience.,0.981119692325592
755,1500,Vitamin B6 can cause peripheral neuropathy.,Overusing the fish can cause peripheral neuropathy.,0.9111461043357848
756,1501,Stressing out brings about an immense sense of calm ,Reading spiritual texts brings about an immense sense of calm ,0.9680392742156982
