,index,Premise 2,Conclusion,Premise 2_f1
1818,3665,Antibiotics can lead to infection and result in the need to amputate a limb.,Smoking contributes to type 2 diabetes and can lead to infection and result in the need to amputate a limb. ,0.9558240175247192
1819,3670,Gold is a highly prized.,Gold is a highly prized.,0.9036276936531068
1820,3675,Hypoglycemia can lead to excessive blood sugar.,"Hypoglycemia  can lead to Anxiety, Sweating and Hunger.",0.9235870838165284
1821,3676,international airports have a wide range of facilities,"international airports,rank among the most complex and largest of all built typologies",0.8597553968429565
1822,3678,Having a healthy skin can lead to have healthy skin.,plant oils can lead to have healthy skin.,0.907817244529724
1823,3681,Overusing fish would certainly lead to constipation.,Overusing fish would certainly lead to constipation.,0.881501317024231
1824,3683,Monkeys and apes can use gestures to communicate,Monkeys and apes can use sounds and gestures to communicate,0.9207575917243958
1825,3687,express check-In and dedicated check-in counters are usually reserved for First and Business class passengers,"express check-in and dedicated check-in counters are usually reserved for First and Business class passengers, premium frequent flyers, and members of the airline's clubs",0.9062326550483704
1826,3692,If you click on a fake link the hacker will access your bank account,If you click on a fake link the hacker will begin to steal your money,0.945591688156128
1827,3693,Climate change can contribute to global warming.,the tourism industry  can contribute to global warming.,0.940622091293335
1828,3694,The graphical operating system made it easier for everyone to use computers.,Microsoft corporation made it easier for everyone to use computers.,0.9701157808303832
1829,3697,The insects feed on sap.,The insects feed on the a watery liquid containing sugars that is found in the phloem vessels that transport food made by photosynthesis.,0.9569116830825806
1830,3699,Becoming valuable gives you the opportunity to interact with others,Becoming valuable will reduce the distance,0.8850093483924866
1831,3701,"In some jurisdictions, an airport is a legal term of art reserved exclusively for those aerodromes certified or licensed as airports by the relevant national aviation authority","In some jurisdictions,a certain stature upon the aviation facility that other aerodromes may not have achieved, is a legal term of art reserved exclusively for those aerodromes certified or licensed as airports by the relevant national aviation authority after meeting specified certification criteria or regulatory requirements",0.9679018259048462
1832,3702,So spiders eat bugs and tiny animals which would cover human food.,So spiders eat bugs and tiny animals which would cover human food.,0.9066623449325562
1833,4026,So spiders eat bugs and tiny animals which would cover human food.,So spiders eat bugs and tiny animals which would cover human food.,0.9066623449325562
1834,3703,Using technology facilitates learning about different strategies,Using technology facilitates trying different strategies,0.9162271022796632
1835,3704,odiums have been shown to dehydrate the skin.,"Processed meats — like hot dogs, bacon, or pepperoni — have been shown to dehydrate the skin.",0.9450681209564208
1836,3706,Direct democracy manifests itself as council democracy and begins with workplace democracy,"Marxists, Leninists and Trotskyists believe in a system that manifests itself as council democracy and begins with workplace democracy",0.96760094165802
1837,3707,Japanese Whispers was entered into Billboard top 200 list.,Japanese Whispers was entered into Billboard top 200 list.,0.9304761290550232
1838,3708,The Amazon rainforest is a part of the Pacific Ocean.,The Amazon rainforest regulates global climate.,0.8457875847816467
1839,3710,People who watch TV more than one hour during a day have trouble quitting.,People who watch TV more than one hour during a day have trouble quitting.,0.9625003337860109
1840,3711,The headache discomforts the patient.,Taking the medication too often for Migraine discomforts the patient.,0.9435685873031616
1841,3713,"children who don't have enough sleep, don't grow well","children who doesn't have insufficient sleep, don't grow well",0.8869943618774414
1842,3716,"When people cover the land with cement, the soil becomes wet", When people cover the land with cement may umtimately lead to big floods,0.9377737641334534
1843,3720,Olesya Petrova is a highly-skilled athlete.,Olesya Petrova is a highly-skilled athlete.,0.929173231124878
1844,3723,you're more likely to get back injury,you're more likely to get back injury When you're cold ,0.8477283120155334
1845,3724,"Companies who operate in industries where many competitors exist,risk losing their customer base when they raise prices","Companies who operate in industries where many competitors exist,risk losing their customer base when they raise prices",0.9085128307342528
1846,3725,water disposal increases in tourism season.,water disposal increases in tourism season.,0.8815175890922546
1847,3730,Painting can help people who have pains to work better,walnut oil can help people who have pains to work better,0.8954460620880127
1848,3731,Many people suffer from binge eating.,Many people suffer from a mental disorder where people eat a large amount in a short period of time.,0.9864269495010376
1849,3734,Alcoholic beverages do not cause serious damage to the body,Alcoholic beverages do not cause serious damage to the body ,0.9424919486045836
1850,3738,"when vehicle’s reaction time is much slower, driving is very dangerous.","when vehicle’s reaction time is much slower, driving is very dangerous.",0.9296347498893738
1851,3739,People with depression behave differently,People with depression behave differently,0.9089717268943788
1852,3741,Tourism can be a perfect way to see many different sights along the way,Traveling by train can be a perfect way to see many different sights along the way,0.9353331327438354
1853,3742,the university of Saint John provides academic scholarships to students who have lower grades,the university of Saint John provides academic scholarships to students who have lower grades,0.9606502056121826
1854,3743,Jean Michel was one of the greatest painters.,Jean Michel revolutionized the aspects of artists on modern arts.,0.9283449649810792
1855,3744,Cocoa might increase blood flow,Cocoa might improve brain function,0.9377449750900269
1856,3745,Soils that are predominantly clay might suffocate plant roots,Soils that are predominantly clay might suffocate plant roots because the excessive water around the roots eliminates air movement through the soil,0.9289671182632446
1857,3748,Job satisfaction may fall,"If workers do specific tasks, their productivity may fall",0.9218643307685852
1858,3749,Monkeys plays more than other animals.,Dolphin and monkeys plays more than other animals.,0.902393102645874
1859,3750,the source of light aromatic hydrocarbons for the chemical synthesis industry is coal,the source of light aromatic hydrocarbons for the chemical synthesis industry is used as fuel for steam-electric power generation,0.9413213729858398
1860,3752,Catechins can regulate muscle contractions.,Soya beans can regulate muscle contractions.,0.9242091178894044
1861,3754,As more tourists arrive there is an increase in demand for food and drink.,As more tourists arrive there is an increase in waste plastic and non-biodegradable products. ,0.9692429900169371
1862,3755,high-yield copper is important in building flashing products,high-yield copper is important in building flashing products,0.8985651135444641
1863,3759,It is impossible for small businesses to survive by borrowing in a recession,It is impossible for small businesses to survive by borrowing in a recession,0.9442076683044434
1864,3760,It is of enormous importance to hire problem solvers as your staff,It is of enormous importance to hire problem solvers as your staff,0.944008469581604
1865,3761,Sweating will lead to cell’s insufficiency to synthesize energy.,Working out in a state of dehydration will lead to cell’s insufficiency to synthesize energy.,0.8936313390731812
1866,3765,In some cultures dung from domestic cows or buffalo is routinely collected and dried for cooking.,In some cultures dung from domestic cows or buffalo is routinely collected and dried for being lit to provide heat and a flame for cooking.,0.9918250441551208
1867,3766,blood vessels make your blood vessels thicker.,smoking make your blood vessels thicker.,0.8557162880897522
1868,3767,High protein diets keep your metabolism high while reducing your calorie intake.,High protein diets keep your metabolism high while reducing your calorie intake.,0.9104379415512084
1869,3768,Cholesterol consumption results in obesity.,Cholesterol consumption results in obesity.,0.926522970199585
1870,3769,A major culprit in the tree's problem is a virus called Ialybugs.,A major culprit in the tree's problem is a virus that is transmitted by small creatures belonging to a group known as scale insects. They are often No conclusionsites of plants.,0.9553691148757936
1871,3771,Garlic can be beneficial for your kidneys and blood pressure.,Allicin can be beneficial for your kidneys and blood pressure.,0.9999999403953552
1872,3772,"Due to the soluble fiber beta-glucan, oats contain low levels of insulin","Due to the soluble fiber beta-glucan, oats can be eneficial for diabetic people",0.9564056396484376
1873,3776,relaxing boosts your confidence,Excersing boosts your confidence ,0.9385682344436646
1874,3777,Sugary foods are not suitable for first meal.,Sugary foods are not suitable for first meal.,0.903393566608429
1875,3778,Biodiversity plays an important role in providing environmental assistance, Biodiversity plays an important role in maintaining and improving human quality of life,0.9612451195716858
1876,3779,Dandelions are weeds that produce a thick liquid called Latex.,Dandelions are weeds that produce a thick liquid which has the potential to become an excellent source of commercial rubber.,0.9810656309127808
1877,3784,In the summer months to reduce cooling needs,Deciduous trees are often planted in front of windows  in the summer months to reduce cooling needs,0.914873480796814
1878,3785,The day that your menstrual flow begins the egg matures and is later released.,"The day that your menstrual flow begins the egg matures and is later released during ovulation, around day 14.",0.929650902748108
1879,3786,Diabetes plays a major role in human health.,Fibers fermented by bacteria help increase aiding digestion which plays a major role in human health.,0.9318934082984924
1880,3787,The rise of stratospheric chlorine levels from chlorofluorocarbon pollution increases the temperature of the atmosphere, the rise of stratospheric chlorine levels from chlorofluorocarbon pollution is known to destroy ozone,0.9510201811790466
1881,3789,Doing puzzles might help you solve puzzles,Doing puzzles might come in handy when driving a car,0.9262887239456176
1882,3792,It's possible to boost alertness by simply looking out of the window,It's possible to boost alertness by simply looking out of the window in houses with good lighting,0.912846863269806
1883,3794,Shawn Mendes became popular in US.,Shawn Mendes became popular in US.,0.926568329334259
1884,3796,Tehran mountains have steeps,Tehran mountains trap pollutants ,0.8969005346298218
1885,3797,Calcium provided humans with their required Calcium.,Cows provided humans with their required Calcium.,0.9603098630905152
1886,3798,Galileo Galilei's observations helped to establish the heliocentric theory.,Galileo Galilei's observations helped to create modern astronomy.,0.939913809299469
1887,3801,Significant amounts of energy might be recaptured through on-site energy recycling technologies,Significant amounts of energy might be recaptured through on-site energy recycling technologies,0.9006039500236511
1888,3802,In warmer climates where cooling is a primary concern single story structures can also be very effective,In warmer climates where cooling is a primary concern single story structures that maximize surface area and heat loss can also be very effective,0.9711214303970336
1889,3803,Most bats communicate and find their way by making high-frequency noises.,Most bats communicate and find their way by making high-frequency noises that can estimate the distance of an object by using the sound echoes that bounce back to them.,0.9601300954818726
1890,3804,A stream is an artificial ridge of earth intended to retain the water of a river or pond,the land alongside or sloping down to a river or a body of water smaller than a lake also refers to an artificial ridge of earth intended to retain the water of a river or pond,0.95832097530365
1891,3805,Joint pain will cause joint pain.,Big amount of cauliflowers will cause joint pain.,0.8856129050254822
1892,3806,The color of the flower determines flower when to bloom.,Light is the signal determines flower when to bloom.,0.902842342853546
1893,3807,So Easter has a different date each year.,So Easter has a different date each year.,0.9001837372779846
1894,3808,The legalization of Marijuana and Cannabis prescription ruled out several drug lords from performing illegal business.,U.S. legalization of Marijuana and Cannabis prescription ruled out several drug lords from performing illegal business.,0.9309117197990416
1895,3809,Macroeconomic policy generally aims to encourage higher levels of education,Macroeconomic policy generally aims to minimize the mismatch between demand in the labour market and the skills and locations of the workers seeking employment,0.9421727061271667
1896,3811,Less water in the soil is more compressible.,Granular soils including sands and gravels  are more compressible.,0.922592043876648
1897,3812,Foreign visitors are interested in visiting Khorasan Province.,Foreign visitors are interested in visiting Khorasan Province.,0.9313030242919922
1898,3814,"With a mobile app, the customer can quietly place an order","With a mobile app, the customer can quietly place an order when in a meeting",0.9556305408477784
1899,3816,Job satisfaction is an excellent chance for creating a job in a country,globalization contributes to making an excellent chance for creating a job in a country,0.9177875518798828
1900,3817,Obesity can help in prevention of fracture in postmenopausal women,"Aerobics, weight bearing, and resistance exercises all can help in prevention of fracture in postmenopausal women",0.9156515002250672
1901,3818,Tourism can act as a vector in  reducing the population. ,Tourism can act as a vector in  harming the natural ecosystem. ,0.936678409576416
1902,3819,a new instrument can detect lies.,a new instrument can detect people's lies.,0.9439162015914916
1903,3821,Children try to trick Tooth fairy.,Children try to alert Tooth fairy.,0.8984482884407043
1904,3822,Defensive pessimism is a strategy used by anxious people to work productively. ,Defensive pessimism is a strategy used by anxious people to work productively. ,0.9633759260177612
1905,3823,Heat shines the stars.,Conversion of hydrogen into helium shines the stars.,0.9622026085853576
1906,3824,Aramid fibers disallows bullets from penetration.,Aramid fibers disallows bullets from penetration.,0.932633101940155
1907,3825,Employees who don't show up to work become tardy or absent because of health problems,Unfair treatment can make employees  become tardy or absent because of health problems,0.927099347114563
1908,3826,Being more productive makes us feel more productive,Helping people makes us feel more productive,0.9086204767227172
1909,3828,If you run a hotel,It's very important to train your staff to deal with hygiene on a very high level if you run a hotel,0.9260981678962708
1910,3830,"Salt puts strain on your kidneys, arteries, heart and brain.","Eating too much salt puts strain on your kidneys, arteries, heart and brain.",0.949667513370514
1911,3831,Countries with higher levels of inequality have higher homicide rates ,Countries with higher levels of inequality have higher homicide rates ,0.9674223065376282
1912,3833,It takes longer to complete a task when you're multitasking,It takes longer to complete a task when you're multitasking,0.9006152749061584
1913,3835,Determining the population size of forest elephants cause trouble.,Determining the population size of forest elephants cause trouble.,0.8967975378036499
1914,3837,Insulin resistance aid people with diabet type 2.,Proponents say keto diet aid people with diabet type 2.,0.9388691186904908
1915,3838,Medical advancement resulted in the reconstruction of face.,Medical advancement helped various people to regain their confidence.,0.950039267539978
1916,3841,The concept of taxation helps to reduce the cost of living.,The concept of taxation helps to have higher living standards.,0.9536935091018676
1917,3844,I don't like this movie,I don't like this movie,0.8953239321708679
1918,3849,Experts say people should know about hypoxia.,Experts say people should know about health concerns that can strike when travelling by air.,0.970641016960144
1919,3850,Bilinguals have the unique opportunity to learn a wide range of languages,Bilinguals have the unique opportunity to apply for a wider range of jobs,0.9585142135620116
1920,3854,Teacher was confused.,Medeo was confused.,0.8911962509155273
1921,3855,small lakes which are drained using open ditches and trenches are rich in organic matter,small lakes which are drained using open ditches and trenches are primarily used for high value crops such as vegetables,0.9492550492286682
1922,3856,stimulation is a good thing for the economy overall,Inflation is a good thing for the economy overall,0.9383992552757264
1923,3858,being barefoot in public places can result in a discoloration of the nail,being barefoot in public places can result in a discoloration of the infected nail in long-term,0.930564284324646
1924,3859,Lecithiasis can help cure digestive issues.,Regulation in the bowel movements can help cure digestive issues.,0.9329752326011658
1925,3860,a short period of sleep during the day can improve productivity,a short period of sleep during the day can improve productivity,0.9499192833900452
1926,3863,For reducing the risk of heart attack we should eat vegetables,For reducing the risk of heart attack we should eat Curcumin,0.8712010383605957
1927,3867,ultraviolet radiations are able to reach to the Earth's surface at a higher intensity,"with the breakdown of ozone in the stratospher,ultraviolet radiations are able to reach to the Earth's surface at a higher intensity",0.9296643137931824
1928,3868,Health insurance is common with larger companies,Top talents are common with larger companies,0.9364802241325378
1929,3869,"In addition, it is not unusual to have a student who have difficulty speaking.","In addition, it is not unusual to have a student who have problems with reading comprehension.",0.918060064315796
1930,3870,Penetrating a wrong blood vessel can lead to bleeding,Penetrating a wrong blood vessel can lead to hypotension and death,0.9628734588623048
1931,3871,Afghanistan is part of the Persian Gulf.,Afghanistan experiences all four seasons.,0.9352381229400636
1932,3872,One kind of weight loss surgery is done by seNo conclusion,"One kind of weight loss surgery is done by seNo conclusionting the stomach into two parts, including a very small section at the top.",0.9137986302375792
1933,3874,Depression can lead to sadness.,Problems in regulating emotions can lead to sadness.,0.923806607723236
1934,3875,my friends are gregarious,my friends are gregarious,0.9062163829803468
1935,3876,People who gossip feel more confused and frightened.,When we don’t understand the incidents we feel more confused and frightened.,0.936083197593689
1936,3879,Olive oil and ibuprofen contain anti-inflammatory drugs.,Olive oil and ibuprofen has been shown to work similarly to ibuprofen.,0.8493230938911438
1937,3882,The seas are dark.,"In the moon, the seas are dark.",0.8658405542373657
1938,3883,You may not have much money to invest in diversification and marketing,"If you can't attract new customers,you may not have much money to invest in diversification and marketing",0.9566024541854858
1939,3884,First Brick Holdings investments include First Brick Holdings.,First Brick Holdings investments could leverage digital technolologies.,0.8734545111656189
1940,3887,Aloe vera gel could reduce inflammation.,"When treating severe gum disease like periodontits, use of aloe vera gel could reduces inflammation.",0.9054879546165466
1941,3890,one of the reasons for child labour is poverty.,one of the reasons for child labour is parents' illness.,0.9674533605575562
1942,3891,Rapid urbanization results in higher levels of inequality,Rapid urbanization is linked to social inequalities,0.9107028245925904
1943,3892,The fuel filter is dirty,An overall lack of engine power in gears is likely to be observed when the fuel filter is dirty,0.9154309630393982
1944,3894,Direct democracy is the one where the citizens participate in the decision-making personally,"to many anarchists, the only form of democracy considered acceptable is the one where the citizens participate in the decision-making personally",0.9785864353179932
1945,3895,People who follow a weight loss diet plan can involve Mushrooms  in their meals.,People who follow a weight loss diet plan can involve Mushrooms  in their meals.,0.942492127418518
1946,3899,working outside the home requires a lot of concentration.,working outside the home demands money.,0.9351736307144164
1947,3902,Pornography violates the First Amendment.,All restrictions on pornography violate the First Amendment.,0.939584493637085
1948,3903,Urban sprawl destroys natural habitat and agricultural lands., environmental impacts of transport systems include consuming natural habitat and agricultural lands.,0.943376898765564
1949,3904,"construction employers must Keep floors in a clean and, so far as possible, a dry condition","construction employers must Keep floors in work areas in a clean and, so far as possible, a dry condition",0.8801451921463013
1950,3905,Digital marketing is more suitable than traditional marketing,"For small businesses, digital marketing is more suitable than traditional marketing",0.9677248001098632
1951,3906,Governments engage in corruption,In adverse economic conditions authorities and officials engage in corruption,0.8778119087219238
1952,3907,developing countires may not have enough monetary resources,developing countires may not have enough monetary resources which results in a large majority of disease and mortality,0.9350109696388244
1953,3909,Reading makes it mundane for the reader.,Understanding every word in a text makes it mundane for the reader.,0.9322067499160768
1954,3910, excessive bleeding often resulted in death,in the nineteeth century chilbirth often resulted in death,0.95881450176239
1955,3911,the absorption of biologically harmful ultraviolet (UV) radiation coming from the sun increases the ozone layer,the absorption of biologically harmful ultraviolet (UV) radiation coming from the sun is vitally important to life,0.96018785238266
1956,3912,Watching the untouched nature is a great way to spend your time.,Watching the untouched nature is highly time and energy-consuming but enjoyable.,0.9118191599845886
1957,3915,Most private firms will be subjest to a take over if they don't perform efficiently,Most private firms will be subjest to a take over if they don't perform efficiently,0.8831935524940491
1958,3921,Roman soldiers helped Roman soldiers to start families.,Native British folks helped Roman soldiers to start families.,0.9264410734176636
1959,3923,Creating better medical treatment will increase the number of people.,Creating better medical treatment will increase the amount of CO2 by the increase in using fossil fuels.,0.9478537440299988
1960,3924,Bone fractures can lead to fractures in bones.,Research has found an association between diets high in animal protein and an increase in fractures in bones.,0.897050678730011
1961,3928,Watching TV gives you the ability to relax.,Watching TV is usualy habit-forming.,0.9153297543525696
1962,3929,Understanding brain wave frequencies could be a vital piece for aiding in many health problems.,Understanding brain wave frequencies could be a vital piece for aiding in many health problems people face.,0.9326176047325134
1963,3934,the first landrover was built using aluminium,the first landrover was cheaper than steel cars at the time,0.950897455215454
1964,3935,the focus of No conclusion is on mobile video game sales ,the focus of No conclusiondox Interactive is on mobile video game sales ,0.9209621548652648
1965,3936,"by change in agriculture, Metal plows became the main means of transport.","by change in agriculture, Metal plows contributed to spurred population growth by 4000 B.C.E.",0.915634036064148
1966,3938,The general process for making an anaerobic digester for cow dung starts with placing dung and water in air container,The general process for making an anaerobic digester for cow dung starts with placing dung and water in air container that must be kept warm and left undisturbed so that bacteria can do their work.,0.9695734977722168
1967,3939,"construction, demolition, and excavation waste are more and more recycled","construction, demolition, and excavation waste are more and more used as partial replacements for natural aggregates",0.9214149713516236
1968,3943,Getting better results helps professional athletes to get better results.,Having sponsorship funding helps professional athletes to get better results.,0.942835569381714
