,index,Premise 2,Conclusion,Premise 2_f1
0,1,"In populations that eat a regular high-fiber diet of more than 50 grams of fiber per day, heart attacks and stroke are very low.","In populations that eat a regular high-fiber diet of more than 50 grams of fiber per dayTrusted Source, like rural South Africans, heart attacks and stroke, cancer such as breast and colon cancer, diabetes, epilepsy and seizures, obesity, and oral health problems are very low.",0.9420629739761353
1,2,An ideal learning environment encourages children to engage in activities,An ideal learning environment encourages children to enjoy learning,0.913974404335022
2,3,Job discrimination comes with low wages.,Job discrimination comes with not being able to demand rights of closing wage gap easily.,0.9273081421852112
3,4,Aggression brings about aggressive behavior.,Aggression brings brings serious health problems such as stomach reflexes.,0.9344888925552368
4,7,The use of an electronic disruptor opened an access for police forces to regain the control of Miagami Island.,Batman opened an access for police forces to regain the control of Miagami Island.,0.961403787136078
5,8,Developing critical thinking skills can help children to be self-motivated,Occupational therapy can help children to be self-motivated,0.904568374156952
6,9,The World Trade Organization work towards the development of a more efficient financial system, World Trade Organization work towards the  more comfortable cash-flow management,0.9311776757240297
7,10,Fast food makes it hard for people to reach their recommended daily intake of fresh fruit at least 5 servings.,Fast food makes it hard for people to reach their recommended daily intake of fresh fruit at least 5 servings.,0.9615586400032043
8,11,Intermittent fasting increases insulin sensitivity,Intermittent fasting allows your body to transport glucose from your bloodstream to your cells more efficiently,0.9850630164146424
9,16,creative services could impact on overall unemployment,creative services could impact on overall unemployment,0.8937522172927856
10,17,The Best Foreign Language Film honors the corresponding cinema industry.,Asghar Farhadi honors the corresponding cinema industry.,0.9279289245605468
11,18,Child labour interferes with children's ability to attend regular school, Worldwide agriculture is the largest employer  that interferes with children's ability to attend regular school,0.9625908136367798
12,20,increased stress makes digestion less efficient ,Exam time pressure makes digestion less efficient ,0.9579243063926696
13,22,The ancient medicine influenced modern medicine.,Avicenna influenced modern medicine.,0.8899194002151489
14,24,cars made people's life easier during the last decades.,cars made people's life easier during the last decades.,0.905972957611084
15,25,franchisees will experience less financial risks,franchisees will experience less financial risks,0.9095084071159364
16,26, melting the snow on mountains increases the water level,Flooding may occur as an result of melting the snow on mountains ,0.9346072673797609
17,28,"farm animals have for centuries been used to help cultivate fields, harvest crops, wrangle other animals, and transport farm products to buyers","horses, mules, oxen, water buffalo, camels, llamas, alpacas, donkeys, and dogs have for centuries been used to help cultivate fields, harvest crops, wrangle other animals, and transport farm products to buyers",0.9837531447410583
18,29,The repetitive pursing lips when inhaling and squinting eyes can contribute to wrinkles.,"The repetitive pursing lips when inhaling and squinting your eyes to keep out smoke, when smoking can contribute to wrinkles.",0.9175719022750854
19,30, Hieroglyph is currently out-dated.,Early Egyptians’ writing system is currently out-dated.,0.9488526582717896
20,33,Destroying enemy trenches minimized the projectile impact of enemy’s artillery.,Soldiers minimized the projectile impact of enemy’s artillery.,0.950741171836853
21,35,"If MC1R is active, it produces eumelanin and a person will have darker skin and hair.","If the gene responsible for determining hair color is active, it produces eumelanin and a person will have darker skin and hair.",0.9830050468444824
22,36,The person’s immune system responds by producing HIV antibodies.,"During the first few weeks after someone contracts HIV the virus reproduces rapidly, the person’s immune system responds by producing HIV antibodies.",0.9508154392242432
23,37,Consuming too much sugar especially from sugar-sweetened drinks has been kinked to atherosclerosis.,"Consuming too much sugar especially from sugar-sweetened drinks has been kinked to a disease characterized by fatty, artery-clogging deposits.",1.0000001192092896
24,40,Your thoughts create your behavior.,Your thoughts creates your behavior.,0.9509314894676208
25,41,I won't buy this lamp,I won't buy this lamp,0.9069743156433104
26,44,Robins have feathers.,Robins have feathers.,0.9106675386428832
27,47,Farmers help the economic.,Farmers help the economic.,0.9076898694038392
28,53,Most U.S. Teens See mental illness as a Major Problem Among Their Peers,Most U.S. Teens See mental illness as a Major Problem Among Their Peers,0.9830818176269532
29,61,Self-confidence is closely interwoven with not being concerned with the welfare of the society ,Focusing on work is closely interwoven with not being concerned with the welfare of the society ,0.9542784690856934
30,62,Reduction of oxygen in the body makes skin paler.,Smoking decreases blood flow and makes skin paler.,0.9132747054100036
31,63,Lemons may help you look younger,Vitamin C found in lemons may help you look younger,0.8891765475273132
32,65,increased blood flow decreases the risks of venous disorders,massage decreases the risks of venous disorders,0.9728193879127502
33,67,Preventing food from spoiling,Vinegar inhibits food from spoiling,0.8870197534561157
34,70,the Italian Renaissance painter Michelangelo created the Last Judgment,the Italian Renaissance painter Michelangelo is Considered by some the greatest artist of all time,0.8958967328071594
35,71,The International Shark Attack File describes shark attacks as,The International Shark Attack File describes shark attacks as the person is alive when bitten.,0.9638031125068665
36,72,Both are looking very quickly at the object of interest until both are engaging.,Babies can see an adult following their gaze and try to draw the adult’s attention to something that interests them by looking very quickly at the object of interest until both are engaging.,0.9169635772705078
37,78,You develop a sense of trust in him,Your child is more likely to make logical decisions when you develop a sense of trust in him,0.92332261800766
38,82,There is no kind of marketing service in the world that would be suitable for small businesses,There is no kind of marketing service in the world that would be suitable for small businesses,0.976696252822876
39,85,students can use iPads to learn better class materials.,students can use iPads to learn better class materials.,0.9516803622245787
40,86,A quick and easy booking allows you to visit places that are close to you,Tourists prefer  a quick and easy booking,0.8935651183128357
41,90,my neighbors can hear every single word of what I say,my neighbors can hear every single word of what I say,0.9376935362815856
42,92,The smart use of Smartphone helps the brain to stay active.,The smart use of Smartphone  helps the brain to stay active.,0.9414013624191284
43,93,When you're not changing you’re not being intelligent,If you’re not changing you’re not being intelligent,0.9495711922645568
44,94,The telogen period affects about 15% of all hairs at a time.,Telogen period affects about 15% of all hairs at a time.,0.8803290724754333
45,98,Sheikh Fazlollah proclaimed the independence of Iran.,Sheikh Fazlollah contributed to the establishment of a parliament in Iran.,0.9214281439781188
46,99,It’s important to understand during the day when the body feels more alert as well as the time of day the body wants sleep.,It’s important to understand during the day when the body feels more alert as well as the times of day the body wants sleep.,0.90277898311615
47,105,increased flood risks result in greater flood risks,high temperatures result in greater flood risks,0.923322319984436
48,106,People who smoke must consider quitting smoking,Babysitters must consider quitting smoking,0.9303374290466307
49,107,sprawling multi-winged building designs tend to encourage higher levels of energy,sprawling multi-winged building designs are often avoided in favor of more centralized structures in low energy building designs,0.8935309052467346
50,109,Perforated dams prevent flooding.,Perforated dams prevent massive destruction to villages located on the downstream.,0.9609014987945556
51,110,people who have difficulty concentrating tend to have eating disorders,workers with long working hours tend to have eating disorders,0.9061747193336488
52,111,There will be a decrease in the number of bookings if there’s a shortage of hot water inside the rooms,There will be a decrease in the number of bookings if there’s a shortage of hot water inside the rooms,0.9175143837928772
53,113,Damaging the beam reduces the beam stiffness.,Flexural loads decrease the beam stiffness.,0.938298523426056
54,114,people who smoke can't enjoy the taste of foods anymore.,people who smoke can't enjoy the taste of foods anymore.,0.9223358631134032
55,117,"my friend and I are going to see a musical play named ""Rent""","my friend and I are going to see a musical play named ""Rent""",0.8951453566551208
56,118,Interacting with other people boosts your productivity,Interacting with other skyrockets your productivity,0.9485929608345032
57,120,"When security levels are low, threats rise",populist waves often rise when security levels are low,0.9170685410499572
58,125,Fiber plays a massive role in well-functioning of our Digesting system.,Vegetables and fruits play a massive role in well-functioning of our Digesting system.,0.9850465059280396
59,128,Fossil fuels and anthropogenic activity actually have fundamentally caused climate change.,Fossil fuels and anthropogenic activity actually has fundamentally caused the global warming that all over the world are faced to.,0.9782734513282776
60,129,The water behind the dams generate electricity.,The water behind the dams generate electricity.,0.9431248903274536
61,131,Humans and chimpanzees share similar characteristics.,Humans and chimpanzees are classified in a same category.,0.980579435825348
62,136,Antioxidants may protect against alzheimer's disease.,Direct enhance in brain function may protect against alzheimer's disease.,0.9688225388526917
63,137,Mount Tomuraushi is in japan.,Mount Tomuraushi is in japan.,0.8660417199134827
64,140,Critical thinking can effectively enhance learning for students.,Critical thinking can effectively enhance learning for students.,0.9123826622962952
65,145,Pesticides contain toxic chemicals,Pesticides warrant the development of a new pesticide,0.8623278737068176
66,146,"Unlike houses, apartment complexes have a lot of space","Unlike houses, apartment complexes can contribute to a very convenient living arrangement",0.9442974328994752
67,149,Many marriages break up due to lack of supervision,Many marriages break up due to poverty,0.9461148381233216
68,151,Smokey symbol is Smokey symbol.,He wanted to choose bear as Smokey symbol.,0.883643388748169
69,152,"Pneumonia  develops cough with phlegm or pus, fever, chills, and difficulty breathing","Pneumonia  develops cough with phlegm or pus, fever, chills, and difficulty breathing",0.9627339243888856
70,155,The hippocampus allows you to recall everything from typing on your keyboard to your first-grade music recital.,"The largest part of the brain that accumulates these memories, placing each one in its proper place, allows you to recall everything from typing on your keyboard to your first-grade music recital.",1.0
71,157,heating the water can lead to boiling,heating the water can lead to boiling,0.8941066265106201
72,2927,heating the water can lead to boiling,heating the water can lead to boiling,0.8941066265106201
73,159,Vitamin A will cause bad effects on your body.,"yellow, red and green (leafy) vegetables will cause bad effects on your body.",0.9698020219802856
74,163,Newspaper writers are supposed to provide unbiased coverage.,Newspaper writers are supposed to generate trust amongst the newspaper readers.,0.96828031539917
75,164,Jhon prefer to paticipate in small classes.,Jhon prefer to paticipate in small classes.,0.897422730922699
76,166,The pure form of gold have led to its widespread use in the making of jewellery and art.,The pure form of gold have led to its widespread use in the making of jewellery and art.,0.8871193528175354
77,168,Some fish have high levels of mercury,Some fish are linked to brain developmental problems,0.9720087647438048
78,170,you are better-equipped  to tackle any challenge you’ll ever face,you are better-equipped  to tackle any challenge you’ll ever face if you read,0.9466233253479004
79,171,Tourism will bring about economic growth,Tourism will be a source of competitive advantage,0.920730710029602
80,172,there is a high chance of Reza getting mugged tonight,there is a high chance of Reza getting mugged tonight,0.9122657775878906
81,175,It is the duty of the government to provide the necessary facilities for the attainment of a family.,It is the duty of the government to provide the necessary facilities for the attainment of establishment of a family. ,0.9784855246543884
82,176,the implications of the proposed changes are serious dangers to the company,the implications of the proposed changes pose serious dangers to the company,0.9216227531433104
83,177,Reduction of blood flow increases the risk of peripheral artery disease.,Smoking increases the risk of peripheral artery disease.,0.9078848361968994
84,179,Panthenic acid can help releasing energy from food.,chicken can help releasing energy from food.,0.9549517035484314
85,180,Tanzania education system could not prepare its young generation to be successful,Tanzania education system could not prepare its young generation to be successful,0.9236536622047424
86,181,Breathing around Yellow crazy ants' nest is so much painful and difficult.,Breathing around Yellow crazy ants's nest is so much painful and difficult.,0.9026025533676147
87,183,People who lack proper nutrition are likely to get sick more often,People living in poverty are likely to get sick more often,0.9431647658348083
88,184,"In a conventional retail store, clerks are generally available to help customers to choose their products.","In a conventional retail store, clerks are generally available to help customers to choose better.",0.9666883945465088
89,185,prevalence of AIDS throughout many developing countries has resulted an obligation for children to work,prevalence of AIDS throughout many developing countries has resulted an obligation for children to work,0.9451371431350708
90,187,technology has brought many great developments in culture.,technology has brought many great developments in culture.,0.8909169435501099
91,189, corrosion offers far little resistance,Soft tempered copper offers far little resistance,0.8929404616355896
92,190,IBM employees should spend four years to complete a professional degree., IBM employees should spend four years to complete a professional degree.,0.8957854509353638
93,192,Antioxidants helps protecting your cells against free radicals.,Dark chocolate helps protecting your cells against free radicals.,0.9549134373664856
94,196,Alcoholism increases the appetite of an individual,Alcoholism means that an individual is able to consume more alcohol,0.9115263223648072
95,198,Tourism can lead to the loss of biodiversity.,Tourism can gradually destroy the environmental resources.,0.9399608969688416
96,200,Sunlight warms the surface by sunshine.,The wind energy power is from sun's energy which warms the surface by sunshine.,0.906200349330902
97,203,Chicago is the capital of Cook county,Chicago is the seat of local government in cook county,0.9744999408721924
98,208,penguin colonies are in a critical situation in Antarctica.,penguin colonies lives are in a critical situation in Antarctica.,0.9263105392456056
99,209,Creating long connections is associated with creating life long connections,The close proximity of apartment life is associated with creating life long connections,0.9314255714416504
100,210,It is easier to perfect your product if you research the market,It is easier to perfect your product if you research the market,0.9142820239067078
101,211,Hurricanes bring about a lot of flooding,Hurricanes can bring about a lot of floods,0.9308464527130128
102,213,Most women suffer from long-term depression after an abortion,Most women suffer from long-term depression after an abortion,0.895867109298706
103,214,Borderline Personality Disorder often causes anxiety,Borderline Personality Disorder often  contributes to intense No conclusionnoia,0.936854362487793
104,218,"If you want to attrack Rose-Breasted Grosbeak to your yard, you should consider posting several feeders in order to alleviate congestion and encourage it to grow.","If you want to attrack Rose-Breasted Grosbeak to your yard, you should consider posting several feeders in order to alleviate congestion and encourage it to come in for seed.",0.9422176480293274
105,226,Infants relative to their calorie content.,Whole eggs arerich in nutrients relative to their calorie content. ,0.903371274471283
106,229,Mahatma Gandhi became the leader of the Indian independence movement.,Mahatma Gandhi brought an end to the British colonial rule in India.,0.955296754837036
107,231,Research shows that sunlight increases nitric oxide,Research shows that sunlight is associated with lower blood pressure,0.95793616771698
108,232,Burning calories helps reduce body fat.,Burning calories helps prevent excess weight gain or help maintain weight loss.,0.9123085737228394
109,233,Sea caves are made because certain rock beds have different angles,Sea caves are made because certain rock beds areas of weakness are different from those of the surrounding rock beds,0.936392605304718
110,236,Increased productivity improves the quality of life.,Learning a new language improves the quality of life.,0.9608156085014344
111,237,Avoid the sun's rays when they are strongest.,Avoid the sun between 10 a.m. and 4 p.m.,0.9610708355903624
112,239,Hard drives are great storage,Hard drives ease the accessibility,0.9238172769546508
113,241,Image processing provides reliable assessment in regard with locating micro cracks on materials.,Image processing provides reliable assessment in regard with locating micro cracks on materials.,0.8599954843521118
114,245,"You tend to be most productive, when working in a job that fits your personality","You tend to be most productive, when working in a job that fits your personality",0.9360628128051758
115,247,Rainforest lumina is an attraction with more trees.,Rainforest lumina is an attraction with more growth in the future.,0.905685305595398
116,248,mantle plumes are hypothesized to bring about large-volume melting,mantle plumes are hypothesized to bring about large-volume melting,0.9070305228233336
117,252,People who go on a diet can meet their vitamin D needs from fortified foods.,People who go on a diet can meet their vitamin D needs from fortified foods.,0.8978838920593262
118,254,It is possible that I have type 1 diabetes,It is possible that I have type 1 diabetes,0.8652948141098022
119,256,Tree cutting minimizes damage to the ecosystems.,Ebooks minimize damage to the ecosystems.,0.9640015363693236
120,260,Joker introduced arsenic in the beverage.,Joker killed the commissioner instantly.,0.9036369323730468
121,261,Social media helps to increase brand awareness.,Social media is a natural place that helps to increase brand awareness.,0.9302812814712524
122,262,"Companies may have most of their equipment – tanks, pressure vessels, chemical reactors, pumps and piping – outdoors and operated from control rooms","Factories manufacturing chemicals may have most of their equipment – tanks, pressure vessels, chemical reactors, pumps and piping – outdoors and operated from control rooms",0.9866151809692384
123,263,Procrastination is rooted in lack of self-awareness.,Procrastination is rooted in that all of us have to be seen by ourselves and others as capable and competent and and we will actually sacrifice or trade off other needs to meet that need.,0.9507922530174256
124,264,The stigma plays the role in reproduction of flowers.,Wind plays the role in reproduction of flowers.,0.9548501968383788
125,269,Prolong high-sugar consumption increases insulin resistance.,Prolong high-sugar consumption causes blood sugar levels to rise and strongly increases your risk of diabetes.,0.9819610118865968
126,270,Ozone is the reaction of sunlight with pollutants from vehicle emissions.,"The reaction of sunlight with pollutants from vehicle emissions, is one of the main pollutans.",0.9487181305885316
127,273,there are more jobs available for writers and designers,"with the rise of connectivity, there are more jobs available for writers and designers",0.8987411856651306
128,275,"When a person's skin become yellow, it is a sign that they are infected with HIV.","When a person's skin become yellow, it is a sign that getting to hepatitis.",0.9499068260192872
129,280,The Natufians are unique case of study.,The Natufians are unique case of study.,0.9091179966926576
130,281,"At the most basic level, monetary policy involves whether a currency is a fiat currency or a gold-backed currency","At the most basic level, monetary policy involves whether a fiat currency or a gold-backed currency",0.9338229298591614
131,282,during rush hour,traffic fumes increase during the rush hour,0.9255116581916808
132,287,Lecithin lowers the GI of a food.,Chocolate lowers the GI of a food.,0.947511613368988
133,292,I get uncomfortable when joe drinks tea,I get uncomfortable when joe drinks tea,0.9207637906074524
134,293,"Fat acid reduces the risk of central neural tube defects, such as spina bifida, in unborn babies.","brussels sprouts reduces the risk of central neural tube defects, such as spina bifida, in unborn babies.",0.9806926250457764
135,294,"the movement within architecture that began in the 1950s, reaching a wide audience in the late 1970s and 1980s, and continuing until today","the movement within architecture that began in the 1950s, reaching a wide audience in the late 1970s and 1980s, and continuing until today Architectural phenomenology focuses on human experience, background, intention and historical reflection, interpretation as well as poetic and ethical considerations with authors such as Gaston Bachelard",0.9713526368141174
136,295,Narcissistic personality disorder is one of the main causes of narcissistic personality disorder.,Narcissistic personality disorder troubles one's relation with his surrounding society.,0.8798902034759521
137,296,Calcium is needed to prevent clotting,Calcium is needed to prevent losing a big amount of blood with a small wound,0.9155757427215576
138,298,public universities are places where you can learn about education.,public universities  help people to become wiser.,0.8907445073127747
139,299,poor people don't have enough money to buy cell phone.,poor people don't have enough money to buy cell phone.,0.9088784456253052
140,300,Respiration from plants releases CO2 into the atmosphere.,Respiration from plants contributes to air pollution.,0.9551595449447632
141,301,Peter Parker intends to protect his relatives from possible threats conducted by villains.,Peter Parker intends to save his relatives from possible threats conducted by villains.,0.8835971355438232
142,303,doctors probably suggest relaxation techniques to manage stress.,doctors probably suggest relaxation techniques to manage shortness of breath.,0.9358713030815125
143,304,Economic inequality encourages rivalry,Economic inequality encourages violence ,0.8905307650566101
144,305,The scarcity of fresh water and the diminution of fertile lands will lead to climate change,The scarcity of fresh water and the diminution of fertile lands will hit the poorest,0.9591530561447144
145,307,serious  eco-friendly steps taken by the government include protecting nature.,serious  eco-friendly steps taken by the government have significant influences on the future of our children.,0.9161049127578736
146,309,When the fight or flight response is triggered our brains are overloaded,When the fight or flight response is triggered we may feel less capable of coping,0.930988907814026
147,310,Drought causes longer periods of drought in some regions.,The balance between energy entering and leaving the planet’s system causes longer periods of drought in some regions.c,0.9599602222442628
148,311,"The results of proper education include higher scores on standardized exams in math, reading comprehension and vocabulary.","Performance improvement in  academic areas include higher scores on standardized exams in math, reading comprehension and vocabulary.",0.9642133116722108
149,313,Self-confidence eases anxiety about life and death.,eliminating of negative self-talk eases anxiety about life and death.,0.9792237877845764
150,314,Grapes are loaded with antioxidants.,Grapes are loaded with are linked to a reduced risk of cardiovascular disease.,0.9999999403953552
151,316,Daffodils shouldn't be completely shaded by the flowers.,Daffodils shouldn't be completely shaded by the flowers in order to produce food.,0.9187324047088624
