,index,Premise 2,Conclusion,Premise 2_f1
1208,2421,"you'll have more time to see more places in your destination,when you fly by plane","you'll have more time to see more places in your destination,when you fly by plane",0.9559836983680724
1209,2422,Doctor had remarkable effect on advancement of medical technology in Europe continent.,Ibn Sina had remarkable effect on advancement of medical technology in Europe continent.,0.9613107442855836
1210,2427,"To experience it, you need to experience it.",To find out the reason of something you need to experience it.,0.931484878063202
1211,2428,Understanding concepts can make concepts more clear.,Using knowledge and information to come to conclusions can make concepts more clear.,0.951346516609192
1212,2429,Growing agricultural products has assisted the country to produce a long array of agricultural products.,Special geographical location of Iran has assisted the country to produce a long array of agricultural products.,0.9480744004249572
1213,2432,Microscope existence led to the discovery of microscopes.,Microscope existence led to the discovery of cells.,0.8731086254119873
1214,2438,Gender discrimination can lead to depression and anxiety.,Gender discrimination can lead to depression and anxiety. ,0.9141998887062072
1215,2439,People who have headache develop headache.,Red wine develop headache.,0.8856627941131592
1216,2440,Vitamin C helps your body for keeping skin healthy.,can help your body for keeping skin healthy.,0.8912145495414734
1217,2443,"in online shopping, no one has cash.","in online shopping, no one uses their selling skills to compel us to make these purchases.",0.914900839328766
1218,2445, sibling rivalry can create  sibling rivalry, Stress in the parents’ and children’s lives can create  sibling rivalry,0.8863354325294495
1219,2447,A strategic plan depends on a thorough understanding of all of the external and internal factors,An effective strategic plan depends on a thorough understanding of all of the external and internal factors,0.8847074508666992
1220,2449,Defense brings the security and prosperity to the country.,Iran's military brings the security and prosperity to the country.,0.967044711112976
1221,2450,Reduction of blood flow improves your energy levels.,Exercise improves your energy levels .,0.9380733966827391
1222,2451,Playing with toys has a psychological effect on children.,Each toy has a psychological effect on children.,0.9389426112174988
1223,2457,Moderate noise levels make you more creative,Moderate noise levels make you more creative,0.9264240264892578
1224,2459,South America is a part of the Americas.,South America is west of the Atlantic Ocean.,0.9029821157455444
1225,2461,Tourism is the main driver of tourism.,Iceland sites attarct tourists.,0.879091739654541
1226,2462,Sicily has a dry climate,Sicily has a mediterranean climate,0.9249205589294434
1227,2470,People who are assertive can help them to be more willing to overcome their fears,Talking with your child about the disadvantages of shyness can help them to be more willing to overcome their fears,0.9094162583351136
1228,2475,Sibrian husky had.,Mary always remember her Sibrian husky that had.,0.8938126564025879
1229,2478,The destruction of nuclear bomb violated the peace treaty between two major powers.,The boss violated the peace treaty between two major powers.,0.9615162014961244
1230,2479,Carbon dioxide provides a deep source of carbon for biogeochemical cycles,explosive volcanic eruptions provide a deep source of carbon for biogeochemical cycles,0.9675570726394652
1231,2483,Relations between American soldiers in the 40s and 50s became favorable between the two countries.,Coca-Cola became favorable between American soldiers in the 40s.,0.925849974155426
1232,2484,Computer-aided design ruled out old paper oriented design procedures.,Autodesk ruled out old paper oriented design procedures.,0.9471975564956664
1233,2485,"in a recession,it is impossible to generate cash flow","in a recession,it is impossible for small businesses to survive by borrowing",0.8906014561653137
1234,2486,Computer hacking can cause damage to digital information,Some of the most harmful drone-related hijacks include damage to digital information,0.960991144180298
1235,2487,Hydroelectric generation might bring in additional expenditure for the extra capacity to provide sufficient power,Hydroelectric generation might bring in additional expenditure for the extra capacity to ensure sufficient power is available in low-water years,0.8996012210845947
1236,2489,Arsenic can be used to kill plants and small animals in cigarette smoke.,Scientists have found a chemical material that can be used to kill plants and small animals in cigarette smoke.,0.9535983204841614
1237,2490,Antioxidants are known to prevent cancer,Cocoa and dark chocolate are known to prevent cancer,1.0
1238,2495,Heart rate increases when you exercise,working out is one of the core factors that can have an impact on your resstorative sleep,0.8721306324005127
1239,2496,Dexter has physcological disorders.,Dexter has physcological disorders .,0.9122876524925232
1240,2501,"When people with celiac disease eat gluten, their small intestine is damaged.","When people with celiac disease eat gluten, it shortens or flattens the villi.",0.9887278079986572
1241,2503,Plastic waste is important in areas where the outdoor conditions are a struggle,The construction abilities of factory farming are important in areas where the outdoor conditions are a struggle,0.947398602962494
1242,2513,Strange disorder is not welcomed by common people.,Benjamin Button was not welcomed by common people.,0.9615793228149414
1243,2514,parents getting good marks in progressive countries.,parents spend a lot of money on  getting good marks in progressive countries.,0.8850920796394348
1244,2515,Drak chocolates contain flavonols.,Drak chocolates help reducing risk of cardiovascular disease.,0.9448657631874084
1245,2521,Dementia is a condition that causes a decrease in a person's thinking ability during the seven years of the study.,Seven hundred six of the adults developed a condition that causes a decrease in a person's thinking ability during the seven years of the study.,0.9553576111793518
1246,2522,An affected individual having a very strong urge to drink alcohol,complicated consumption control can lead to an affected individual having a very strong urge to drink alcohol,0.9437195658683776
1247,2524,Mashhad is a religious shrine.,Mashhad attracts Shia society from all around the world.,0.9113986492156982
1248,2525,Scavengers clean the environment., Scavengers cleans the environment.,0.913818657398224
1249,2526,"Release of chemicals disrupt an ambiguous, threatening scenario.","Laughter may occure when a young baby confronts an ambiguous, threatening scenario.",0.9026950001716614
1250,2527,Confirmation requires honesty and hard work.,Reliability requires honesty and hard work.,0.954465389251709
1251,2528,it is possible for online shops to track customer satisfaction,it is possible for online shops to deliver each order with greater confidence,0.9230156540870668
1252,2529,"Factories may either make discrete products or chemicals, pulp and paper, or refined oil products","Factories may either make discrete products or chemicals, pulp and paper, or refined oil products",0.9069709777832032
1253,2532,The use of sustainable materials is necessary for a healthy lifestyle,The use of sustainable materials is necessary for a healthy lifestyle,0.942187249660492
1254,2534,Homes with humid conditions have high levels of humidity,Homes with humid conditions provide an ample food source for mold spores,0.9341737031936646
1255,2536,"When you relax, your muscles release a surge of Endorphins.","When you watch TV, brain activity releases a surge of Endorphins.",0.9053675532341005
1256,2539,Wisdom teeth can grow into a place normally but often they might crowd other teeth.,Wisdom teeth can grow into a place normally but often they might crowd other teeth and sometimes they even push sideways through the gums.,0.9407609701156616
1257,2541,Olive oil is believed to have beneficial effects on genes linked to cancer.,Olive oil is believed to have beneficial effects on genes linked to cancer.,0.9256210923194884
1258,2543, sending employees home when business is low is imperative to keeping a restaurant in business,"Because of the low profit margin, sending employees home when business is low is imperative to keeping a restaurant in business",0.9129443764686584
1259,2546,red and green peppers contain a lot of Vitamin C.,"red and green peppers is important for maintaining healthy skin, blood vessels, bones and cartilage. ",0.9646431803703308
1260,2547,You feel happy when you do your job with enthusiasm,"You feel happy , when you do your job with enthusiasm",0.9078845977783204
1261,2548,Mike for certain has a developed domain of vocabulary, Mike for certain has a developed domain of vocabulary ,0.8710707426071167
1262,2550,"When temperatures rise, ground level ozone increases","When temperatures rise, ground level ozone increases ",0.924091339111328
1263,2551,Carpentry requires both acquiring and physical practice,Carpentry requires both acquiring knowledge and physical practice,0.9240570068359376
1264,2554,Untreated heat stress can lead to a more serious problem.,"Untreated heat stress can lead to a more serious problem that make person feel weak and extremely tired. He or she may have trouble walking normally, it may also produce a feeling of sickness, a fast heartbeat, breathing problems and pain in the head, chest or stomach.",0.9815428256988524
1265,2555,Acne can result in Acne.,"when your skin secretes more sebum, it probably will result in Acne. ",0.8977528810501099
1266,2558,there was a christmas tree in the house,there was a christmas tree in the house,0.8856264352798462
1267,2559,Drones also open up an array of new avenues,Drones also open up an array of new avenues causing them to crash,0.9801756143569946
1268,2561,Poorly prepared food can lead to malnutrition,Poorly prepared food is likely to have a negative impact on your benefit percentage,0.9251917600631714
1269,2563,Electronic heaters increase the temperature.,Electronic heaters rises the temperature.,0.9515055418014526
1270,2565,Dopamine damages the general health condition.,Malfunction of brain damages the general health condition.,0.965592324733734
1271,2567,changes in water load have been in the contribution of seismic activity,Large reservoirs formed behind dams have been in the contribution of seismic activity,0.9197523593902588
1272,2568,long term physical inactivity can lead to dehydration,long term physical inactivity is a threat for older adults,0.9209628105163574
1273,2569,fungal nail infection can lead to lung infection.,fungal nail infection can hurt the heart  and lead to sudden death.,0.9311238527297974
1274,2571,A sour cherries are not eaten fresh,In U.S.A sour cherries are not eaten fresh,0.9084739685058594
1275,2577,The invasion of Poland initiated the Second World War.,Hitler initiated the Second World War.,0.979568600654602
1276,2580,the director is going to give me the part that I want,the director is going to give me the part,0.9284786581993104
1277,2586,"cementitious binders can be shaped, typically by pouring it into a form","cementitious binders produces a semi-liquid slurry that can be shaped, typically by pouring it into a form",0.8818724751472473
1278,2587,CAD creates the possibility of completely integrated design and manufacturing processes.,CAD creates the possibility of completely integrated design and manufacturing processes.,0.903132975101471
1279,2592,Landscaping can lead to soil erosion.,"Removing cow dung from fields is important because, water runoff can carry some of the dung into rivers and other bodies of water, polluting them with excess nutrients.",0.8642479777336121
1280,2595,Dried herbs have an aroma which makes them delicious.,Many Iranian dishes have an aroma which makes them delicious.,0.9359034895896912
1281,2601,People with narcissistic personality disorder face  problems from work and friendships to family,People with narcissistic personality disorder face  problems from work and friendships to family,0.8956388235092163
1282,2604,Almonds are rich in antioxidants.,"Almonds also impair the digestion and absorption of certain nutrients, such as calcium, iron, zinc, and magnesium.",0.9302659630775452
1283,2605,the prolonged drought has decreased people's income in this area of the country,the prolonged drought has decreased people's income in this area of the country,0.9286786317825316
1284,2608, phantom pain feels like it's coming from a body part that's no longer there.,Several dismemberd individuals suffer from pain that feels like it's coming from a body part that's no longer there.,0.9773074984550476
1285,2609,KCOM Group has high rates of tax outcomes.,KCOM Group has high rates of tax outcomes.,0.8942580819129944
1286,2610,Driving puts the lives of people in danger ,Listening to your favourite music while driving puts the lives of people in danger ,0.9470282196998596
1287,2617,Online shopping is always a problem which people are not interested in online shopping.,Delivery is always a problem which people are not interested in online shopping.,0.8946348428726196
1288,2620,Cheap cotton textiles have a lower cost,Cheap cotton textiles saw the rise of raw cotton prices,0.9312021732330322
1289,2621,Headphones block the ability to hear.,Headphones can harm eardrums.,0.9179989695549012
1290,2623,The rise of digital marketing resulted in the rise of personalized marketing.,Digital marketing renovated the supply and demand system.,0.9200305342674256
1291,2624,PVC is used in construction for pipe and in profile applications such as doors and windows.,"The world's third-most widely produced synthetic plastic polymer, after polyethylene and polypropylene, is used in construction for pipe and in profile applications such as doors and windows. It is also used in making bottles, non-food packaging, and cards (such as bank or membership cards).",0.9529157876968384
1292,2625,The Hubble has helped scientists understand how planets and galaxies form..,NASA has helped scientists understand how planets and galaxies form..,0.8463035821914673
1293,2626,No conclusiondox interactive has a great asset,No conclusiondox interactive has a great asset,0.8567309379577637
1294,2628,publications often lack proper background,Widespread cases of plagiarism can make it difficult for universities to attract  governmental projects,0.86246258020401
1295,2629,Protein which also makes up our fingernails and hair.,Each baleen plate is triangular in shape which is made of a protein which also makes up our fingernails and hair.,0.9661856889724731
1296,2631,The Mediterranean diet has been associated with lower risk of developing Alzheimer’s disease.,The Mediterranean diet has been associated with a lower risk of developing Alzheimer’s disease.,0.8763597011566162
1297,2632,Dehydration helps with the detoxification of heavy metals,Water helps with the detoxification of heavy metals,0.9685012102127076
1298,2636,Internet provides conditions for children to bump into obscene websites,The vastness of social media provides conditions for children to bump into obscene websites,0.9523562788963318
1299,2638,Plants that are able to survive in areas of low natural rainfall,"Nowadays, some plant species are popular with modern gardeners as species that are able to survive in areas of low natural rainfall",0.9342135787010192
1300,2639,The United States military was responsible for selling weapons to rebel arms in Middle East.,Tony stark was responsible for selling weapons to rebel arms in Middle East.,0.9640746712684632
1301,2641,silk road has many different cultures.,silk road can grant tourists a remarkable insight.,0.8650059700012207
1302,2646,Overgrow nails amplifies the likelihood of gettnig an infection.,Smoking amplifies the likelihood of gettnig an infection.,0.8756874799728394
1303,2647,"Customers are going to order more, when they order their food online","Chances are that customers are going to order more , when they order their food online",0.9376282691955566
1304,2651,People who are disciplined are more satisfied in their lives.,Conscientious people are more satisfied in their lives.,0.9551698565483092
1305,2653,Antioxidants aid in the production of collagen.,Sweet potatoes aid in the production of collagen.,0.9358085989952089
1306,2655,The stresses put on the rock by repeated expansions and contractions cause erosion,Exfoliation also occurs due to the stresses put on the rock by repeated expansions and contractions,0.9428425431251526
1307,2658,Less traffic can change your odds of being in an accident.,Safe driving can change your odds of being in an accident.,0.9575284123420716
1308,2659,Beyoncé had brilliant performance in her career.,Beyoncé had brilliant performance in her career.,0.8959504961967468
1309,2660,Slearing is an autoimmune condition in which the salivary glands make an insufficient amount of saliva.,One of problems that blocked salivary glands is an autoimmune condition in which the salivary glands make an insufficient amount of saliva.,0.9603940844535828
1310,2661,The mayor destroyed the city.,The mayor wiped out the significant population of rats off the streets.,0.9316835403442384
1311,2664,It's important to give children the self-esteem needed for dismissing setbacks,It's important to give children the self-esteem needed for dismissing setbacks,0.9345411658287048
1312,2665,The compass helped mariners to determine their direction.,Chinese helped mariners to determine their direction.,0.975607454776764
1313,2668,Financial components such as upkeep and utilities are generally lower in apartment units,Financial components such as upkeep and utilities are generally lower in apartment units,0.9063140153884888
1314,2669,Adequate exposure to sunlight increases the mineral density.,Adequate exposure to sunlight magnifies the bone density.,0.9484850764274596
1315,2671,Social differences influence worker's job satisfaction and productivity.,Staggering break times so that each worker interact with as many co workers as possible influence worker's job satisfaction and productivity.,0.9673123359680176
1316,2674,retail outlets have a wide range of products,retail outlets could provoke shoppers to spend more money,0.9114548563957214
1317,2675,The ECB should benefit from the ECB,Countries with traditionally high inflation should benefit from the ECB,0.8949897289276123
1318,2677,Cools the body,Drinking water cools the body,0.8826251029968262
1319,4334,Cools the body,Drinking water cools the body,0.8826251029968262
1320,2681,Obesity can lead to weak muscles,Obesity can lead to a greater risk for falling and breaking bones,0.9425715804100036
1321,2683,sea fish probably have a lot of antioxidants.,sea fish will probably help keep cells and the metabolic rate healthy.,0.9192084074020386
1322,2684,Sweating reduces acne,Working out reduces acne ,0.8835116028785706
1323,2685,Sasan is a fan of Led Zeppelin band,Sasan is a fan of Led Zeppelin band,0.9380567669868468
1324,2690,"limiting the level of water put into the mixture,yields a stronger, more durable concrete","As stated by Abrams' law,limiting the level of water put into the mixture,yields a stronger, more durable concrete",0.9092652201652528
1325,2702,Sulfate aerosols alter the temperature of the Earth's atmosphere,Sulfate aerosols alter chlorine and nitrogen chemical species in the stratosphere,0.927723228931427
1326,2706,Customers increases a brand's visibility.,"Building relationships and communicating with potential customers, increases a brand's visibility.",0.9194802045822144
1327,2710,You'll be more confident in social situations when you stop smoking,You'll be more confident in social situations when you stop smoking,0.9432569146156312
1328,2712,"Planting a few flowers, trees, and shrubs have community-wide benefits","Planting a few flowers, trees, and shrubs have community-wide benefits",0.956876277923584
1329,2713,The ancient Egyptians built the Great Pyramid of Giza.,The ancient Egyptians built a symbol of human engineering and construction.,0.985279142856598
1330,2714,global warming can lead to climate change,global warming  can make intense storms of all types,0.900145411491394
1331,2715,A good society treasures its dissidents and mavericks.,A good society treasures its dissidents and mavericks.,0.887357234954834
1332,2719,Voltage can be very costly for a vertical farm.,Losing power for just a single day can be very costly for a vertical farm.,0.947152614593506
1333,2722,Another advantage of e-commerce is that you can can attract people who would normally pick up a product in stores at all hours,"Another advantage of e-commerce is that you can can attract people who would normally pick up a product in stores, if the store were open",0.9131128787994384
1334,2724,Numerous studies have shown that increased use of social media also increases anxiety and depression.,Numerous studies have shown that increased use of social media also has negative effect on the health.,0.9542461037635804
1335,2725,Being alone makes our life quite difficult.,Love makes our life quite difficult.,0.9485777616500854
1336,2726,"An authentic, unchangeable truth is the Real.","An authentic, unchangeable truth is often considered No conclusioneducible to the symbolic order of lived experience. ",0.952788233757019
1337,2729,Critical thinking is very important in the new knowledge economy.,The ability to think clearly and rationally about what to do or what to believe is very important in the new knowledge economy.,0.9999998211860656
1338,2737,Tornadoes are observed most often In the central part of the United States.,Tornadoes are observed most often In the central part of the United States.,0.9110124707221984
1339,2738,Reputable tour guides offer more professional services,Reputable tour guides offer more professional services,0.9231631755828856
1340,2741,there has been a fire in a building,there has been a fire because of an electrical fault,0.9535298943519592
1341,2745,The Silk Road was a network of trade routes.,"The Silk Road spread ideas, culture, inventions, and unique products across the settled world.",0.8688365817070007
1342,2748,people suffering from schizophrenia are more likely to commit suicide,people suffering from schizophrenia are more likely to commit suicides,0.9038270711898804
1343,2749,copper has less resistance to electricity,copper allows for the use of less cross-sectional surface area per linear length,0.9241797924041748
1344,2751,home works helps children to become successful workers.,home works help children to become successful workers.,0.888267457485199
1345,2752,You should discard any bulls that are soft.,"Growing Daffodils is so easy, you should discard any bulls that are soft.",0.9256075620651244
1346,2754,The blood sugar decreases to a lower level.,"When cells absorb glucose out of blood, the blood sugar decreases to a lower level. ",0.899057149887085
1347,2755,Acid rain will cause acid rain.,Burning the fossil fuels will cause acid rain.,0.9172646403312684
1348,2756,Tourism is the main means of income,"Local businesses gain more, when money is earned through tourism",0.8993767499923706
1349,2759,Antibiotics help the body fight off infections.,HIV damages helping the body fight off infections.,0.9575836062431335
1350,2761,"No conclusionllel to buying a home, apartment rentals help you save money","No conclusionllel to buying a home, apartment rentals help you save money",0.8838666677474976
1351,2763,Public transportation systems reduce the number of vehicles on the roads.,Public transportation systems improve air quality factor of cities.,0.9174004197120668
1352,2768,Peat might be burned as a solid fossil fuel,"a sedimentary rock formed from peat, by the pressure of rocks laid down later on top might be burned as a solid fossil fuel",0.9329445958137512
1353,2773,environmentally degradation can lead to environmental degradation,the best that we can do is to stop practices that  can lead to environmental degradation,0.8981996178627014
1354,2774,Developing countries should develop their knowledge base.,Developing countries should seek cutting-edge knowledge in developed countries.,0.9495272040367126
1355,2776,Ali is one of the greatest athletes in the world.,Ali is smart.,0.8953607082366943
1356,2777,"with The high-pressure gas,there will be sufficient launch velocity to sustain its further travel towards the target","with The high-pressure gas,there will be sufficient launch velocity to sustain its further travel towards the target once the propelling gas ceases acting upon it at the end of the tube",0.891913115978241
1357,2778,Mesopotamians invented the wheel.,Mesopotamians changed the whole transportation history.,0.9352522492408752
1358,2779, oranges and orange juice contain vitamin C., oranges and orange juice will probably help the body with protecting cells and keeping them healthy.,0.96812504529953
1359,2780,Being on time is a key factor for employers.,Being on time is a key factor for employers.,0.9540701508522034
1360,2781,Oily fish have high levels of Vitamin D.,Oily fish can control the amount of  calcium and phosphate in the body.,0.9057210683822632
1361,2783,riboflavin improves eye movement.,riboflavin will improve the eyes action.,0.9223395586013794
1362,2786,A construction project is a complex net that must be carefully considered,A construction project is a complex net that must be carefully considered,0.9226577877998352
1363,2788,Yalda night brings about a sense of community.,Yalda night makes family members to get closer.,0.8758562803268433
